Handle,Title,Body (HTML),Vendor,Type,Tags,Published,Option1 Name,Option1 Value,Variant Price,Variant Inventory Policy,Variant Fulfillment Service,Variant Requires Shipping,Variant Taxable,Status,Metafield: custom.flavor_base [color],Metafield: custom.flavor_top [color],Metafield: custom.speck [color],Metafield: custom.allergenes [list.single_line_text]
choco-sel,choco noir fleur de sel,"chocolat noir intense, éclats de fleur de sel.",texture,cookie,cookie,TRUE,Title,Default Title,4.00,deny,manual,TRUE,TRUE,active,#5a3a2a,#8a5a3e,#2c1c12,"[""gluten"",""lait"",""œuf"",""soja""]"
pistaches,pistaches,"pâte de pistache de sicile, croquant beurré.",texture,cookie,cookie,TRUE,Title,Default Title,4.50,deny,manual,TRUE,TRUE,active,#7a9a3e,#a8c466,#4c6420,"[""gluten"",""lait"",""œuf"",""fruits à coque""]"
ube,ube,"igname violette, glaçage lacté, couleur folle.",texture,cookie,cookie,TRUE,Title,Default Title,4.50,deny,manual,TRUE,TRUE,active,#7a4ea8,#a878d6,#4e2c70,"[""gluten"",""lait"",""œuf""]"
speculoos,speculoos,"épices spéculoos, cœur fondant caramélisé.",texture,cookie,cookie,TRUE,Title,Default Title,4.00,deny,manual,TRUE,TRUE,active,#a9743e,#cf9a5e,#6e4620,"[""gluten"",""lait"",""œuf"",""soja""]"
banana-chips,banana chips,"banane séchée, chips croustillantes.",texture,cookie,cookie,TRUE,Title,Default Title,4.00,deny,manual,TRUE,TRUE,active,#cda83e,#e6cc66,#8a6e1e,"[""gluten"",""lait"",""œuf""]"
matcha-noisettes,matcha noisettes,"matcha cérémonial, noisettes torréfiées.",texture,cookie,cookie,TRUE,Title,Default Title,4.00,deny,manual,TRUE,TRUE,active,#5a9a5e,#88c488,#346436,"[""gluten"",""lait"",""œuf"",""fruits à coque""]"
